{
  "schema_version": "1.0.0",
  "package_id": "NEXUS_RP_YYYYMMDDTHHMMSSZ_slug_00000000",
  "created_at_utc": "YYYY-MM-DDTHH:MM:SSZ",
  "updated_at_utc": "YYYY-MM-DDTHH:MM:SSZ",
  "phase": "R5",
  "strand": "github-framework",
  "title": "Human-readable package title",
  "objective": "Coherent research objective",
  "state": "INTAKE",
  "owners": ["AXIOM", "CURSOR_PRAXIS"],
  "producer": "AXIOM",
  "intended_processor": "CURSOR_PRAXIS",
  "claim_ceiling": "C1",
  "claim_promotion": false,
  "integration_authority": "NONE",
  "predecessor_packages": [],
  "research_questions": [],
  "item_count": 0,
  "snapshot_count": 0,
  "latest_snapshot": null,
  "uncertainty": [],
  "notes": []
}
